90148,Victor Valley Transit Authority (VVTA),Hesperia,CA,"Victorville--Hesperia--Apple Valley, CA",90541,131.77,355816
90156,City of San Luis Obispo - Public Works,San Luis Obispo,CA,"San Luis Obispo, CA",79147,14.11,56904
90206,San Luis Obispo Regional Transit Authority (SLORTA),San Luis Obispo,CA,"San Luis Obispo, CA",79147,14.11,56904
90162,The Eastern Contra Costa Transit Authority,Antioch,CA,"Antioch, CA",02683,73.35,326205
90171,"City of Santa Clarita (SCT) - Economic Development, Transit Division",Santa Clarita,CA,"Santa Clarita, CA",79309,77.85,278031
90173,Transit Joint Powers Authority for Merced County,Merced,CA,"Merced, CA",56251,43.08,150052
90201,City of Turlock - Transit,Turlock,CA,"Turlock, CA",89083,16.89,79203
90208,Butte County Association of Governments (BCAG),Chico,CA,"Chico, CA",16318,33.72,111411
90213,City of Petaluma - Transit,Petaluma,CA,"Petaluma, CA",68887,20.96,65227
90219,Northern Arizona Intergovernmental Public Transportation Authority (NAIPTA),Flagstaff,AZ,"Flagstaff, AZ",29818,29.26,79842
90232,Solano County Transit,Vallejo,CA,"Vallejo, CA",90028,39.64,175132
90233,Yuma County Intergovernmental Public Transportation Authority (YCAT),Yuma,AZ,"Yuma, AZ--CA",98020,52.96,135717
90306,Stanislaus Regional Transit Authority,Modesto,CA,"Modesto, CA",58006,70.38,357301
