40192,"Martin County (MCBOCC) - Public Works Department, Transit Division",Stuart,FL,"Port St. Lucie, FL",71479,224.23,437745
41199,Board of County Commissioners of St. Lucie County (SLCART) - Transit Department,Fort Pierce,FL,"Port St. Lucie, FL",71479,224.23,437745
40244,"Spartanburg Regional Health Services, Inc. (SRHS)",Spartanburg,SC,"Spartanburg, SC",83548,181.0,196943
40265,North Central Alabama Regional Council of Governments (NARCOG) - Transportation,Decatur,AL,"Decatur, AL",22690,43.47,60458
40950,First Tennessee Human Resource Agency (N.E.T. Trans) - Grants and Compliance Manager at NetTrans,Johnson City,TN,"Johnson City, TN",43210,106.03,128519
41105,"Audubon Area Community Services, Inc. (AACS) - Transportation",Owensboro,KY,"Owensboro, KY",66484,36.4,76433
50001,City of Appleton - Valley Transit,Appleton,WI,"Appleton, WI",02764,107.78,230967
50002,City of Green Bay (GBM) - Transit,Green Bay,WI,"Green Bay, WI",34813,113.66,224156
50003,City of Kenosha (KAT) - Transit,Kenosha,WI,"Kenosha, WI",44506,56.17,125865
50004,City of La Crosse (MTU) - Municipal Transit Utility,La Crosse,WI,"La Crosse, WI--MN",45910,42.24,98872
50005,City of Madison - Metro Transit,Madison,WI,"Madison, WI",53200,149.7,450305
50006,"City of Racine, Wisconsin - Transit",Racine,WI,"Racine, WI",73153,52.26,134877
50008,Milwaukee County (MCTS) - Transportation - Transit,Milwaukee,WI,"Milwaukee, WI",57466,463.68,1306795
50096,City of Waukesha - Transit Commission,Waukesha,WI,"Milwaukee, WI",57466,463.68,1306795
50160,County of Washington - Transit,West Bend,WI,"Milwaukee, WI",57466,463.68,1306795
50161,Ozaukee County (OCTS) - Transit ,Port Washington,WI,"Milwaukee, WI",57466,463.68,1306795
55312,City of Milwaukee (MSS) - Operations / Public Works,Milwaukee,WI,"Milwaukee, WI",57466,463.68,1306795
50010,METRO Regional Transit Authority (METRO),Akron,OH,"Akron, OH",00766,300.64,541879
50021,Portage Area Regional Transportation Authority (PARTA),Kent,OH,"Akron, OH",00766,300.64,541879
50011,Stark Area Regional Transit Authority (SARTA),Canton,OH,"Canton, OH",13375,180.19,295319
50015,The Greater Cleveland Regional Transit Authority (GCRTA),Cleveland,OH,"Cleveland, OH",17668,713.81,1712178
50117,Laketran,Painesville,OH,"Cleveland, OH",17668,713.81,1712178
50198,Medina County (MCPT) - Medina County Public Transit,Medina,OH,"Cleveland, OH",17668,713.81,1712178
50016,Central Ohio Transit Authority (COTA),Columbus,OH,"Columbus, OH",19234,516.16,1567254
50191,Mid-Ohio Regional Planning Commission (MORPC) - Programming Department,Columbus,OH,"Columbus, OH",19234,516.16,1567254
50199,Delaware County Transit Board (DCT),Delaware,OH,"Columbus, OH",19234,516.16,1567254
50017,Greater Dayton Regional Transit Authority (GDRTA),Dayton,OH,"Dayton, OH",22528,319.89,674046
50165,Greene County Transit Board (Greene CATS),Xenia,OH,"Dayton, OH",22528,319.89,674046
50169,"Miami County, Ohio (MCPT)",Troy,OH,"Dayton, OH",22528,319.89,674046
50022,Toledo Area Regional Transit Authority (TARTA),Toledo,OH,"Toledo, OH--MI",87868,240.71,497952
50024,Western Reserve Transit Authority (WRTA),Youngstown,OH,"Youngstown, OH",97831,195.96,320901
50025,Duluth Transit Authority (DTA),Duluth,MN,"Duluth, MN--WI",24850,66.87,119411
50026,City of Moorhead - Mass Transit,Moorhead,MN,"Fargo, ND--MN",29089,77.73,216214
80003,City of Fargo (MATBUS) - Transit Department,Fargo,ND,"Fargo, ND--MN",29089,77.73,216214
50027,Metro Transit ,Minneapolis,MN,"Minneapolis--St. Paul, MN",57628,1014.79,2914866
50154,Metropolitan Council (MC) - Metropolitan Transportation Services,Minneapolis,MN,"Minneapolis--St. Paul, MN",57628,1014.79,2914866
50515,University of Minnesota (UMN) - Parking and Transportation Services,Minneapolis,MN,"Minneapolis--St. Paul, MN",57628,1014.79,2914866
50516,City of Plymouth - Public Works - Transit,Minneapolis,MN,"Minneapolis--St. Paul, MN",57628,1014.79,2914866
50517,City of Maple Grove (MGT) - Engineering Department,Maple Grove,MN,"Minneapolis--St. Paul, MN",57628,1014.79,2914866
50518,SouthWest Transit (SWT),Eden Prairie,MN,"Minneapolis--St. Paul, MN",57628,1014.79,2914866
50519,Minnesota Valley Transit Authority (MVTA),Burnsville,MN,"Minneapolis--St. Paul, MN",57628,1014.79,2914866
50028,St. Cloud Metropolitan Transit Commission,Saint Cloud,MN,"St. Cloud, MN",77338,53.97,117638
50029,Bay Metropolitan Transit Authority (BMTA),Bay City,MI,"Bay City, MI",05869,39.93,68472
50031,Suburban Mobility Authority for Regional Transportation (SMART),Detroit,MI,"Detroit, MI",23824,1284.83,3776890
50119,City of Detroit (DDOT) - Transportation,Detroit,MI,"Detroit, MI",23824,1284.83,3776890
50141,Detroit Transportation Corporation (DTC),Detroit,MI,"Detroit, MI",23824,1284.83,3776890
50193,Michigan Department of Transportation,Lansing,MI,"Detroit, MI",23824,1284.83,3776890
50213,M-1 Rail,Detroit,MI,"Detroit, MI",23824,1284.83,3776890
50032,Mass Transportation Authority (MTA),Flint,MI,"Flint, MI",29872,205.46,298964
50033,Interurban Transit Partnership (ITP),Grand Rapids,MI,"Grand Rapids, MI",34300,274.36,605666
50034,City of Jackson Transportation Authority (JATA),Jackson,MI,"Jackson, MI",42157,52.03,84307
50035,Central County Transportation Authority (CCTA),Kalamazoo,MI,"Kalamazoo, MI",43723,109.46,204562
50036,Capital Area Transportation Authority (CATA),Lansing,MI,"Lansing, MI",47719,155.83,318300
50039,Saginaw Transit Authority Regional Service (STARS),Saginaw,MI,"Saginaw, MI",77149,65.73,116058
50040,Ann Arbor Area Transportation Authority (AAATA),Ann Arbor,MI,"Ann Arbor, MI",02602,143.45,317689
50158,"University of Michigan Parking and Transportation Services (UMTS) - Logisitics, Transportation & Parking",Ann Arbor,MI,"Ann Arbor, MI",02602,143.45,317689
50043,City of Evansville (METS) - Metropolitan Evansville Transit System,Evansville,IN,"Evansville, IN",28333,112.75,206855
50044,Fort Wayne Public Transportation Corporation (FWPTC),Fort Wayne,IN,"Fort Wayne, IN",31087,163.6,335934
50045,Gary Public Transportation Corporation (GPTC),Gary,IN,"Chicago, IL--IN",16264,2337.89,8671746
50066,Chicago Transit Authority (CTA),Chicago,IL,"Chicago, IL--IN",16264,2337.89,8671746
50104,Northern Indiana Commuter Transportation District (NICTD),Chesterton,IN,"Chicago, IL--IN",16264,2337.89,8671746
50113,"Pace, the Suburban Bus Division of the Regional Transportation Authority",Arlington Heights,IL,"Chicago, IL--IN",16264,2337.89,8671746
50118,Northeast Illinois Regional Commuter Railroad Corporation,Chicago,IL,"Chicago, IL--IN",16264,2337.89,8671746
50182,"Pace, the Suburban Bus Division of the Regional Transportation Authority - ADA Paratransit Services",Arlington Heights,IL,"Chicago, IL--IN",16264,2337.89,8671746
50521,Chicago Water Taxi (Wendella) (CWT),Chicago,IL,"Chicago, IL--IN",16264,2337.89,8671746
50047,Bloomington-Normal Public Transit System,Normal,IL,"Bloomington--Normal, IL",08407,50.36,134100
50050,Indianapolis and Marion County Public Transportation (IPTC),Indianapolis,IN,"Indianapolis, IN",41212,722.55,1699881
50209,Central Indiana Regional Transportation Authority (CIRTA),Indianapolis,IN,"Indianapolis, IN",41212,722.55,1699881
50342,Hendricks County Sycamore Services - Transportation Department,Danville,IN,"Indianapolis, IN",41212,722.55,1699881
50051,Greater Lafayette Public Transportation Corporation (GLPTC),Lafayette,IN,"Lafayette, IN",46018,68.74,157100
50052,South Bend Public Transportation Corporation,South Bend,IN,"South Bend, IN--MI",83116,147.93,278921
50053,City of Terre Haute (THTU) - Transit,Terre Haute,IN,"Terre Haute, IN",87139,46.83,79862
50054,Muncie Indiana Transit System (MITS),Muncie,IN,"Muncie, IN",60625,48.2,84382
50056,Greater Peoria Mass Transit District (GPMTD),Peoria,IL,"Peoria, IL",68509,145.79,259781
50057,Rock Island County Metropolitan Mass Transit District (MetroLink),Moline,IL,"Davenport, IA--IL",22366,134.86,285211
70049,River Bend Transit (RBT),Davenport,IA,"Davenport, IA--IL",22366,134.86,285211
50058,Rockford Mass Transit District (RMTD),Rockford,IL,"Rockford, IL",75718,133.81,276443
50059,Springfield Mass Transit District (SMTD),Springfield,IL,"Springfield, IL",83899,81.74,159265
50060,Champaign-Urbana Mass Transit District (C-U MTD),Urbana,IL,"Champaign, IL",15211,46.52,147452
50061,"City of Decatur, Il (DPTS) - Transportation Services Department",Decatur,IL,"Decatur, IL",22717,55.11,86287
50092,"City of Rochester, Minnesota (RPT) - Public Transit",Rochester,MN,"Rochester, MN",75637,51.59,121587
50099,City of Eau Claire (ECT) - Transit,Eau Claire,WI,"Eau Claire, WI",26038,62.5,105475
50110,Bloomington Public Transportation Corporation (BT),Bloomington,IN,"Bloomington, IN",08380,43.04,110103
50145,City of Kokomo (COK) - Transit,Kokomo,IN,"Kokomo, IN",45694,32.5,62576
50146,Madison County Transit District (MCT),Pontoon Beach,IL,"St. Louis, MO--IL",77770,910.37,2156323
70006,Bi-State Development Agency of the Missouri-Illinois Metropolitan District,Saint Louis,MO,"St. Louis, MO--IL",77770,910.37,2156323
70057,Loop Trolley Transportation Development District,Saint Louis,MO,"St. Louis, MO--IL",77770,910.37,2156323
50148,Blue Water Area Transportation Commission (BWATC),Port Huron,MI,"Port Huron, MI",71155,52.51,82226
50149,Michiana Area Council of Governments (MACOG),South Bend,IN,"Elkhart, IN--MI",26794,94.94,148199
50159,River Valley Metro Mass Transit District (RVMMTD),Bourbonnais,IL,"Kankakee, IL",43885,31.66,66530
50163,"Licking County, Ohio (LCT) - Public Transportation",Newark,OH,"Newark, OH",61705,44.09,81223
50176,City of DeKalb (CDPT ) - Public Transit ,Dekalb,IL,"DeKalb, IL",22960,25.63,64736
50184,Macatawa Area Express Transportation Authority (MAX),Holland,MI,"Holland, MI",39430,64.8,107034
50522,Lake Erie Transportation Commission (LET) - Operations,Monroe,MI,"Monroe, MI",58357,35.35,57260
60006,City of El Paso - Mass Transit Department,El Paso,TX,"El Paso, TX--NM",27253,255.88,854584
60007,Fort Worth Transportation Authority (FWTA),Fort Worth,TX,"Dallas--Fort Worth--Arlington, TX",22042,1746.9,5732354
60041,City of Arlington (ADOT) - Transportation Department,Arlington,TX,"Dallas--Fort Worth--Arlington, TX",22042,1746.9,5732354
60056,Dallas Area Rapid Transit (DART),Dallas,TX,"Dallas--Fort Worth--Arlington, TX",22042,1746.9,5732354
60114,STAR Transit (STAR),Terrell,TX,"Dallas--Fort Worth--Arlington, TX",22042,1746.9,5732354
60133,McKinney Avenue Transit Authority (MATA),Dallas,TX,"Dallas--Fort Worth--Arlington, TX",22042,1746.9,5732354
60008,"Metropolitan Transit Authority of Harris County, Texas ",Houston,TX,"Houston, TX",40429,1752.69,5853575
60103,"Fort Bend County, Texas (FBT) - Fort Bend County Public Transportation",Richmond,TX,"Houston, TX",40429,1752.69,5853575
60108,Harris County - Community & Economic Development Department,Houston,TX,"Houston, TX",40429,1752.69,5853575
60009,City of Laredo ,Laredo,TX,"Laredo, TX",47854,64.2,251462
60010,City of Lubbock,Lubbock,TX,"Lubbock, TX",51877,106.27,272280
60011,VIA Metropolitan Transit,San Antonio,TX,"San Antonio, TX",78580,613.44,1992689
60012,City of Waco (WTS) - Transit System,Waco,TX,"Waco, TX",91027,89.88,192844
60014,City of Brownsville (BMetro) - Multimodal Transportation,Brownsville,TX,"Brownsville, TX",10972,62.1,216444
60015,City of Galveston (GIT),Galveston,TX,"Galveston--Texas City, TX",32491,108.98,191863
60016,City of Beaumont (BMT) - Transit,Beaumont,TX,"Beaumont, TX",06058,96.1,146649
60017,Central Oklahoma Transportation and Parking Authority (COTPA),Oklahoma City,OK,"Oklahoma City, OK",65080,421.73,982276
60018,Metropolitan Tulsa Transit Authority (MTTA),Tulsa,OK,"Tulsa, OK",88948,338.32,722810
60019,City of Albuquerque - Transit Department,Albuquerque,NM,"Albuquerque, NM",01171,263.07,769837
60111,Rio Metro Regional Transit District (RMRTD),Albuquerque,NM,"Albuquerque, NM",01171,263.07,769837
60022,Capital Area Transit System (CATS),Baton Rouge,LA,"Baton Rouge, LA",05680,396.34,631326
60024,City of Shreveport - Shreveport Area Transit System,Shreveport,LA,"Shreveport, LA",81739,180.84,288052
60032,New Orleans Regional Transit Authority (NORTA),New Orleans,LA,"New Orleans, LA",62677,270.27,963212
60088,Jefferson Parish - JP Transit,Gretna,LA,"New Orleans, LA",62677,270.27,963212
60276,"Plaquemines Port, Harbor and Terminal District (PPHTD)",Belle Chasse,LA,"New Orleans, LA",62677,270.27,963212
60033,Rock Region Metropolitan Transit Authority,North Little Rock,AR,"Little Rock, AR",50392,267.82,461864
60038,Lafayette City-Parish Consolidated Government (LTS),Lafayette,LA,"Lafayette, LA",46045,161.2,227316
60048,Capital Metropolitan Transportation Authority (CMTA),Austin,TX,"Austin, TX",04384,619.62,1809888
60051,Corpus Christi Regional Transportation Authority (CCRTA),Corpus Christi,TX,"Corpus Christi, TX",20287,129.27,339066
60059,Brazos Transit District (BTD),Bryan,TX,"College Station--Bryan, TX",18748,81.63,206137
60077,City of Santa Fe (SFT) - Transit,Santa Fe,NM,"Santa Fe, NM",79363,46.8,94241
60090,Lower Rio Grande Valley Development Council (LRGVDC) - Valley Metro,Weslaco,TX,"McAllen, TX",52390,326.22,779553
60273,University of Texas Rio Grande Valley (UTRGV) - Parking & Transportation Services,Edinburg,TX,"McAllen, TX",52390,326.22,779553
60091,Hill Country Transit District,Belton,TX,"Killeen, TX",44992,100.42,257222
60095,Golden Crescent Regional Planning Commission (GCRPC),Victoria,TX,"Victoria, TX",90514,33.6,65986
60101,Denton County Transportation Authority (DCTA),Lewisville,TX,"Denton--Lewisville, TX",23500,150.48,429461
60102,Concho Valley Transit District (CVTD),San Angelo,TX,"San Angelo, TX",78553,49.27,99982
60107,"Texoma Area Paratransit System, Inc (TAPS)",Sherman,TX,"Sherman--Denison, TX",81631,38.49,66691
66339,New Mexico Department of Transportation (NMDOT),Santa Fe,NM,"Las Cruces, NM",47935,64.47,139338
70001,City of Lincoln - Transportation & Utilities,Lincoln,NE,"Lincoln, NE",49933,94.17,291217
70002,Transit Authority of Omaha,Omaha,NE,"Omaha, NE--IA",65269,270.81,819508
70275,Nebraska Department of Transportation (NDOT) - Local Assistance Division,Lincoln,NE,"Omaha, NE--IA",65269,270.81,819508
70003,City of Springfield,Springfield,MO,"Springfield, MO",83953,134.33,282651
70005,Kansas City Area Transportation Authority (KCATA),Kansas City,MO,"Kansas City, MO--KS",43912,714.1,1674218
70035,Johnson County Kansas (JCT) - Transit,Olathe,KS,"Kansas City, MO--KS",43912,714.1,1674218
70271,"Kansas City, City of Missouri (KCMO) - Multimodal Division / Public Works Department",Kansas City,MO,"Kansas City, MO--KS",43912,714.1,1674218
70008,City of Cedar Rapids (CRT) - Transit Division,Cedar Rapids,IA,"Cedar Rapids, IA",14752,86.03,192844
70010,Des Moines Area Regional Transit Authority (DART),Des Moines,IA,"Des Moines, IA",23743,224.74,542486
70012,City of Sioux City (SCTS) - Transit,Sioux City,IA,"Sioux City, IA--NE--SD",82225,55.03,113066
70014,Topeka Metropolitan Transit Authority (TMTA),Topeka,KS,"Topeka, KS",88084,84.24,148956
70015,City of Wichita (WT) - Transportation,Wichita,KS,"Wichita, KS",95077,226.84,500231
70016,City of Columbia (COMO) - GoCOMO,Columbia,MO,"Columbia, MO",18937,67.2,141831
70018,City of Iowa City (ICT) - Transit,Iowa City,IA,"Iowa City, IA",41590,50.83,126810
70019,University of Iowa (CAMBUS) - Parking and Transportation Department,Iowa City,IA,"Iowa City, IA",41590,50.83,126810
70030,City of Coralville (CTS) - Transit and Parking,Coralville,IA,"Iowa City, IA",41590,50.83,126810
70045,"County of Johnson, Iowa (SEATS)",Iowa City,IA,"Iowa City, IA",41590,50.83,126810
70041,Ames Transit Agency,Ames,IA,"Ames, IA",02062,22.36,66342
70066,Heart of Iowa Regional Transit Agency (HIRTA),Urbandale,IA,"Ames, IA",02062,22.36,66342
70044,University of Kansas (KUTS) - Transportation Services,Lawrence,KS,"Lawrence, KS",48232,29.92,94998
70048,City of Lawrence - Lawrence Transit,Lawrence,KS,"Lawrence, KS",48232,29.92,94998
80001,Utah Transit Authority (UTA),Salt Lake City,UT,"Salt Lake City, UT",78499,300.42,1178533
80002,City of Sioux Falls (SAM),Sioux Falls,SD,"Sioux Falls, SD",82252,67.9,194283
80004,City of Billings (MET) - MET Transit,Billings,MT,"Billings, MT",07705,54.7,128787
80005,"City of Colorado Springs (MMT) - Public Works, Transit Division",Colorado Springs,CO,"Colorado Springs, CO",18856,200.36,632494
80006,Denver Regional Transportation District (RTD),Denver,CO,"Denver--Aurora, CO",23527,644.54,2686147
80109,Denver Regional Council of Governments (DRCOG) - Way to Go,Denver,CO,"Denver--Aurora, CO",23527,644.54,2686147
80007,City of Pueblo (PT) - Pueblo Transit,Pueblo,CO,"Pueblo, CO",72613,54.7,120642
80008,City of Grand Forks (CAT) - Cities Area Transit,Grand Forks,ND,"Grand Forks, ND--MN",34219,26.48,68160
80009,Missoula Urban Transportation District (MUTD),Missoula,MT,"Missoula, MT",57736,44.29,88109
80107,University of Montana (UDASH) - Associated Students at the University of Montana,Missoula,MT,"Missoula, MT",57736,44.29,88109
80011,City of Fort Collins - Transfort,Fort Collins,CO,"Fort Collins, CO",30628,117.98,326332
80025,"City of Loveland, Colorado (COLT) - Public Works/Transit",Loveland,CO,"Fort Collins, CO",30628,117.98,326332
80106,North Front Range Transportation and Air Quality Planning Council (NFRMPO),Fort Collins,CO,"Fort Collins, CO",30628,117.98,326332
80012,Great Falls Transit District (GFTD),Great Falls,MT,"Great Falls, MT",34759,30.3,67097
80028,Cache Valley Transit District (CVTD),Logan,UT,"Logan, UT",50959,47.72,113927
80285,Via Mobility Services,Boulder,CO,"Boulder, CO",09298,25.45,120828
90001,Regional Transportation Commission of Washoe County (RTC),Reno,NV,"Reno, NV--CA",74179,165.43,446529
90003,San Francisco Bay Area Rapid Transit District (BART),Oakland,CA,"San Francisco--Oakland, CA",78904,513.8,3515933
90009,San Mateo County Transit District (SMCTD),San Carlos,CA,"San Francisco--Oakland, CA",78904,513.8,3515933
90014,Alameda-Contra Costa Transit District,Oakland,CA,"San Francisco--Oakland, CA",78904,513.8,3515933
90015,City and County of San Francisco (SFMTA) - Transit Division,San Francisco,CA,"San Francisco--Oakland, CA",78904,513.8,3515933
90016,"Golden Gate Bridge, Highway and Transportation District (GGBHTD) - Golden Gate Transit; Golden Gate Ferry",San Francisco,CA,"San Francisco--Oakland, CA",78904,513.8,3515933
90094,Metropolitan Transportation Commission (MTC) - Field Operations and Asset Management,San Francisco,CA,"San Francisco--Oakland, CA",78904,513.8,3515933
90134,Peninsula Corridor Joint Powers Board (PCJPB),San Carlos,CA,"San Francisco--Oakland, CA",78904,513.8,3515933
90159,Western Contra Costa Transit Authority (WCCTA ),Pinole,CA,"San Francisco--Oakland, CA",78904,513.8,3515933
90225,San Francisco Bay Area Water Emergency Transportation Authority (WETA),San Francisco,CA,"San Francisco--Oakland, CA",78904,513.8,3515933
90234,Marin County Transit District (MCTD),San Rafael,CA,"San Francisco--Oakland, CA",78904,513.8,3515933
90004,Golden Empire Transit District (GET),Bakersfield,CA,"Bakersfield, CA",04681,132.12,570235
90006,Santa Cruz Metropolitan Transit District (SCMTD),Santa Cruz,CA,"Santa Cruz, CA",79336,60.45,169038
90008,City of Santa Monica (BBB) - Department of Transportation,Santa Monica,CA,"Los Angeles--Long Beach--Anaheim, CA",51445,1636.83,12237376
90010,City of Torrance (TTS) - Transit Department,Torrance,CA,"Los Angeles--Long Beach--Anaheim, CA",51445,1636.83,12237376
90022,City of Norwalk (NTS) - Department of Transportation,Norwalk,CA,"Los Angeles--Long Beach--Anaheim, CA",51445,1636.83,12237376
90023,Long Beach Transit (LBT),Long Beach,CA,"Los Angeles--Long Beach--Anaheim, CA",51445,1636.83,12237376
90024,City of La Mirada (LMT) - CS Department ,La Mirada,CA,"Los Angeles--Long Beach--Anaheim, CA",51445,1636.83,12237376
90036,Orange County Transportation Authority (OCTA),Orange,CA,"Los Angeles--Long Beach--Anaheim, CA",51445,1636.83,12237376
90039,City of Culver City - Transportation Department,Culver City,CA,"Los Angeles--Long Beach--Anaheim, CA",51445,1636.83,12237376
90041,City of Montebello (MBL) - Transportation,Montebello,CA,"Los Angeles--Long Beach--Anaheim, CA",51445,1636.83,12237376
90042,City of Gardena - Transportation,Gardena,CA,"Los Angeles--Long Beach--Anaheim, CA",51445,1636.83,12237376
90043,City of Commerce (CCT) - Transportation,Commerce,CA,"Los Angeles--Long Beach--Anaheim, CA",51445,1636.83,12237376
90146,Foothill Transit,West Covina,CA,"Los Angeles--Long Beach--Anaheim, CA",51445,1636.83,12237376
90147,City of Los Angeles (LADOT) - City of Los Angeles Department of Transportation,Los Angeles,CA,"Los Angeles--Long Beach--Anaheim, CA",51445,1636.83,12237376
90151,Southern California Regional Rail Authority (SCRRA),Los Angeles,CA,"Los Angeles--Long Beach--Anaheim, CA",51445,1636.83,12237376
90154,Los Angeles County Metropolitan Transportation Authority (LACMTA),Los Angeles,CA,"Los Angeles--Long Beach--Anaheim, CA",51445,1636.83,12237376
90157,Access Services (AS),El Monte,CA,"Los Angeles--Long Beach--Anaheim, CA",51445,1636.83,12237376
90211,Anaheim Transportation Network (ATN),Anaheim,CA,"Los Angeles--Long Beach--Anaheim, CA",51445,1636.83,12237376
90214,City of Redondo Beach (BCT) - Transit Division in the Community Services Department,Redondo Beach,CA,"Los Angeles--Long Beach--Anaheim, CA",51445,1636.83,12237376
99423,City of Glendale - Public Works Transit,Glendale,CA,"Los Angeles--Long Beach--Anaheim, CA",51445,1636.83,12237376
99424,City of Pasadena - Transit,Pasadena,CA,"Los Angeles--Long Beach--Anaheim, CA",51445,1636.83,12237376
99425,Pomona Valley Transportation Authority (PVTA),La Verne,CA,"Los Angeles--Long Beach--Anaheim, CA",51445,1636.83,12237376
90012,San Joaquin Regional Transit District (RTD),Stockton,CA,"Stockton, CA",85087,92.46,414847
90182,Altamont Corridor Express (ACE),Stockton,CA,"Stockton, CA",85087,92.46,414847
99422,San Joaquin Council (SJCOG),Stockton,CA,"Stockton, CA",85087,92.46,414847
90013,Santa Clara Valley Transportation Authority (VTA),San Jose,CA,"San Jose, CA",79039,285.48,1837446
90017,City of Santa Rosa - Transit Division,Santa Rosa,CA,"Santa Rosa, CA",79498,79.39,297329
90089,County of Sonoma (SCT) - Department of Public Infrastructure - Transit Division,Santa Rosa,CA,"Santa Rosa, CA",79498,79.39,297329
90299,Sonoma-Marin Area Rail Transit District (SMART),Petaluma,CA,"Santa Rosa, CA",79498,79.39,297329
90019,Sacramento Regional Transit District,Sacramento,CA,"Sacramento, CA",77068,467.58,1946618
90090,Yolo County Transportation District (YCTD),Woodland,CA,"Sacramento, CA",77068,467.58,1946618
90196,County of Placer (PCT/TART) - Department of Public Works,Auburn,CA,"Sacramento, CA",77068,467.58,1946618
90223,"Paratransit, Inc.",Sacramento,CA,"Sacramento, CA",77068,467.58,1946618
90020,Santa Barbara Metropolitan Transit District (SBMTD),Santa Barbara,CA,"Santa Barbara, CA",79282,54.81,202197
90026,San Diego Metropolitan Transit System (MTS),San Diego,CA,"San Diego, CA",78661,674.72,3070300
90030,North County Transit District (NCTD),Oceanside,CA,"San Diego, CA",78661,674.72,3070300
90095,San Diego Association of Governments (SANDAG) - Regional Transportation Services,San Diego,CA,"San Diego, CA",78661,674.72,3070300
90027,City of Fresno (FAX) - Department of Transportation,Fresno,CA,"Fresno, CA",31843,159.11,717589
90029,Omnitrans,San Bernardino,CA,"Riverside--San Bernardino, CA",75340,608.56,2276703
90031,Riverside Transit Agency (RTA),Riverside,CA,"Riverside--San Bernardino, CA",75340,608.56,2276703
90086,"City of Riverside - Parks, Recreation & Community Services / Special Transportation",Riverside,CA,"Riverside--San Bernardino, CA",75340,608.56,2276703
90218,Riverside County Transportation Commission (RCTC),Riverside,CA,"Riverside--San Bernardino, CA",75340,608.56,2276703
90302,San Bernardino County Transportation Authority (SBCTA),San Bernardino,CA,"Riverside--San Bernardino, CA",75340,608.56,2276703
90032,City of Phoenix - Public Transit,Phoenix,AZ,"Phoenix--Mesa--Scottsdale, AZ",69184,1110.48,3976313
90034,City of Glendale (COG) - Transit/Transportation,Glendale,AZ,"Phoenix--Mesa--Scottsdale, AZ",69184,1110.48,3976313
90131,City of Scottsdale (COS) - Public Works/Streets & Transportation,Scottsdale,AZ,"Phoenix--Mesa--Scottsdale, AZ",69184,1110.48,3976313
90136,Regional Public Transportation Authority (RPTA),Phoenix,AZ,"Phoenix--Mesa--Scottsdale, AZ",69184,1110.48,3976313
90140,City of Peoria - Transit,Peoria,AZ,"Phoenix--Mesa--Scottsdale, AZ",69184,1110.48,3976313
90209,"Valley Metro Rail, Inc. (VMR)",Phoenix,AZ,"Phoenix--Mesa--Scottsdale, AZ",69184,1110.48,3976313
90033,City of Tucson (COT) - Department of Transportation & Mobility / Transit Services Division,Tucson,AZ,"Tucson, AZ",88732,357.35,875441
90222,Pima Association of Governments (PAG) - Commuter Services,Tucson,AZ,"Tucson, AZ",88732,357.35,875441
90035,Gold Coast Transit District (GCTD),Oxnard,CA,"Oxnard--San Buenaventura (Ventura), CA",66673,76.61,376117
90164,Ventura County Transportation Commission (VCTC),Camarillo,CA,"Oxnard--San Buenaventura (Ventura), CA",66673,76.61,376117
90062,Monterey-Salinas Transit (MST),Monterey,CA,"Seaside--Monterey--Pacific Grove, CA",80362,41.18,123495
90078,Central Contra Costa Transit Authority (CCCTA),Concord,CA,"Concord--Walnut Creek, CA",19504,175.76,538583
90079,SunLine Transit Agency,Thousand Palms,CA,"Indio--Palm Desert--Palm Springs, CA",41347,151.82,361075
90087,City of Santa Maria (SMRT),Santa Maria,CA,"Santa Maria, CA",79417,27.06,143609
90088,Napa Valley Transportation Authority (NVTA),Napa,CA,"Napa, CA",61057,20.35,84619
90091,City of Visalia (VT) - Transportation ,Visalia,CA,"Visalia, CA",90946,37.7,160578
90310,Tulare County Regional Transit Agency (TCRTA),Visalia,CA,"Visalia, CA",90946,37.7,160578
90092,"City of Fairfield, California - Transportation Division/Public Works Department",Fairfield,CA,"Fairfield, CA",28657,40.81,150122
90142,"University of California, Davis (ASUCD) - Associated Students of the University of California, Davis",Davis,CA,"Davis, CA",22420,12.16,77034
